{"commit":"276008eeec0f10d5322c4c627b8c103222fee841","documentation":[{"digest":{"sha256":"02cae386119443e04e05e246514577ffd831907de1f434feda38d9fde6f2ee23"},"path":"/claim/v0.3/license/"},{"digest":{"sha256":"b019c4a6584a553fea2e66b70f1066f79725cf830a924e055092713996162286"},"path":"/demos/end-to-end/"},{"digest":{"sha256":"4600b5aa609f8440be9e6440a034a00483e88ac6501b9387349b48beafae0b75"},"path":"/predicate/v0.2/origin/"},{"digest":{"sha256":"b290eb3935cbaba417de0d4e7141d10541e2d85bac72dfb90888b2aceae8ec41"},"path":"/predicate/v0.2/transform/"},{"digest":{"sha256":"aacff28515e7b862d91c48e2ac730f53156b7bcb5aaeeebd11b4e9b88a944a57"},"path":"/predicate/v0.3/origin/"},{"digest":{"sha256":"8990a273af95bb78c9736e3a7e3a8a1bb9bde2495047d0abf8b765d790858b55"},"path":"/predicate/v0.3/transform/"},{"digest":{"sha256":"9a44179e2800e9e350a625a222aed57866fb80e68986e0045dcd803a7f0129ad"},"path":"/source/file/"},{"digest":{"sha256":"6e0c3f5b59135df6faf540358bc94cc8b8d43af9277c46081990f5bba1127ed2"},"path":"/spec/v0.2/"},{"digest":{"sha256":"e6b13a122346d475308c7a8a8780f5f1c59475620c3afeba547443a4548fd290"},"path":"/spec/v0.3/"},{"digest":{"sha256":"a78951d3f404ac9fb282f4af8d63a37c290b53bb57e836429e762ad23f8707a9"},"path":"/vocab/v0.2/bounded-pattern/"},{"digest":{"sha256":"bf4d439798bb8a4daf679651e1f043173fe36c67de801c75711716c63560e7ec"},"path":"/vocab/v0.3/bounded-pattern/"}],"repository":"https://github.com/makoto-project/makoto","resources":[{"cors":true,"digest":{"sha256":"421e19cf002aa25cf6f2f9ed788e04c9badfd9cbc6b00030b0b089810b2ae4f8"},"mediaType":"application/json","path":"/demos/end-to-end/artifacts/data/customers.normalized.json"},{"cors":true,"digest":{"sha256":"ecd821dbe6f4204c4aad64878643d7954cb8c94abbf8d0b28f9c2bfc272f781e"},"mediaType":"application/json","path":"/demos/end-to-end/artifacts/data/customers.public.json"},{"cors":true,"digest":{"sha256":"4e90181e7f75ccdf0e4d81c83d281f53806bed241787cdc751e22b2d4cd19919"},"mediaType":"application/json","path":"/demos/end-to-end/artifacts/data/customers.raw.json"},{"cors":true,"digest":{"sha256":"eada72f4d00df064c631efab1f3af6b48fc7de2a1f4ea5e2cffd6c16c7fc1814"},"mediaType":"application/json","path":"/demos/end-to-end/artifacts/manifest.json"},{"cors":true,"digest":{"sha256":"ecd821dbe6f4204c4aad64878643d7954cb8c94abbf8d0b28f9c2bfc272f781e"},"mediaType":"application/octet-stream","path":"/demos/end-to-end/artifacts/positive-bundle/artifacts/final/71895faa8bce0d0426b2e447bb12d15e50e9f9d27135ebabbb94bc9d59426d4e.bin"},{"cors":true,"digest":{"sha256":"648ce73f03bcbc8fb8e7cb41be5dd02d1809163ef7a26ee34ce0f0bbe13039c2"},"mediaType":"application/json","path":"/demos/end-to-end/artifacts/positive-bundle/attestations/1f28b72bcd4c1e9b7df71403ac6bb1670c2f2b09628ca6d76a2fa384db9a0848.dsse.json"},{"cors":true,"digest":{"sha256":"3a29f64b3c19a732f7e49507c798e5cb8b2669f3e3b6b01699af51a880884364"},"mediaType":"application/json","path":"/demos/end-to-end/artifacts/positive-bundle/attestations/56b7be4394fe09c62ec7a3d5763cecc251e9696f267f35b2acc717b0d170a27a.dsse.json"},{"cors":true,"digest":{"sha256":"b465ebfdd192634cc7c50859fca560af0662a2faa1762b70e35dfcb866536dd7"},"mediaType":"application/json","path":"/demos/end-to-end/artifacts/positive-bundle/attestations/99aee76db46a720405da6d0015d427c791b0d4e02367b9e2bc36ce82ae812bce.dsse.json"},{"cors":true,"digest":{"sha256":"a35b35aa42754b01de02fb2572f3c377a0ef1c05f16b2b831363990360d84624"},"mediaType":"application/json","path":"/demos/end-to-end/artifacts/positive-bundle/bundle.json"},{"cors":true,"digest":{"sha256":"8093bb7234ad9d3697881fc7419a6b7b6bd8c3d4b5272c84181380929aee4f01"},"mediaType":"application/json","path":"/demos/end-to-end/artifacts/positive-bundle/manifest.dsse.json"},{"cors":true,"digest":{"sha256":"be9213a1a8faf1587165d905c7cde5d6fd19585a3148494ae64d97240781c6b3"},"mediaType":"application/json","path":"/demos/end-to-end/artifacts/positive-bundle/schemas/catalog.json"},{"cors":true,"digest":{"sha256":"31934d2cf8fa7b5af2f8e4cf591d96278c4f59ddb6bb190afccb93701244f9eb"},"mediaType":"application/json","path":"/demos/end-to-end/artifacts/positive-bundle/schemas/resources/31934d2cf8fa7b5af2f8e4cf591d96278c4f59ddb6bb190afccb93701244f9eb.schema.json"},{"cors":true,"digest":{"sha256":"68169d043c628fda5435cbd7845b02ea3e0d850b7a509c0b35fd304463fffacb"},"mediaType":"application/json","path":"/demos/end-to-end/artifacts/positive-bundle/schemas/resources/68169d043c628fda5435cbd7845b02ea3e0d850b7a509c0b35fd304463fffacb.schema.json"},{"cors":true,"digest":{"sha256":"7f20d92fa844586ce71413dfdcb771d9d60d549f1fb8f5e662e84b1db10d568c"},"mediaType":"application/json","path":"/demos/end-to-end/artifacts/receiver/attacker-known-policy.json"},{"cors":true,"digest":{"sha256":"be9213a1a8faf1587165d905c7cde5d6fd19585a3148494ae64d97240781c6b3"},"mediaType":"application/json","path":"/demos/end-to-end/artifacts/receiver/catalog.json"},{"cors":true,"digest":{"sha256":"ab26b172e0cee9cab64da106e4c6c10c6bcbb7b4497537e8faf500f93af089c5"},"mediaType":"application/json","path":"/demos/end-to-end/artifacts/receiver/customer-public.profile.json"},{"cors":true,"digest":{"sha256":"6c938ed199e83383b3353aea76d311f6f57cf35cdd03260b01f8806105eaf483"},"mediaType":"application/json","path":"/demos/end-to-end/artifacts/receiver/expected-artifact.json"},{"cors":true,"digest":{"sha256":"614eb137303bcea78f25ded2e332a10649358484f9582984c1730ddc106ebfcd"},"mediaType":"application/json","path":"/demos/end-to-end/artifacts/receiver/policy.json"},{"cors":true,"digest":{"sha256":"bacbcae9de19bda95175447480eada15712c8f425d7d5286460a1cc46e8b82cf"},"mediaType":"application/json","path":"/demos/end-to-end/artifacts/receiver/public-transform-metadata.profile.json"},{"cors":true,"digest":{"sha256":"31934d2cf8fa7b5af2f8e4cf591d96278c4f59ddb6bb190afccb93701244f9eb"},"mediaType":"application/json","path":"/demos/end-to-end/artifacts/receiver/resources/31934d2cf8fa7b5af2f8e4cf591d96278c4f59ddb6bb190afccb93701244f9eb.schema.json"},{"cors":true,"digest":{"sha256":"68169d043c628fda5435cbd7845b02ea3e0d850b7a509c0b35fd304463fffacb"},"mediaType":"application/json","path":"/demos/end-to-end/artifacts/receiver/resources/68169d043c628fda5435cbd7845b02ea3e0d850b7a509c0b35fd304463fffacb.schema.json"},{"cors":true,"digest":{"sha256":"c6b36abc1f82983fab37e639f6b43921e0c1e72ca738f0afb8e88d289944f00c"},"mediaType":"application/json","path":"/demos/end-to-end/artifacts/reports/edited-signed-metadata.json"},{"cors":true,"digest":{"sha256":"b64fbcfbd014be75c270adccec2301a2f8cc1717a6e2a86a26ffb9faaf4a2574"},"mediaType":"application/json","path":"/demos/end-to-end/artifacts/reports/mutated-final-data.json"},{"cors":true,"digest":{"sha256":"3395d12cd62bde846297f5b25accf7588598d8aee0dcbdebed30c0a232a4ead8"},"mediaType":"application/json","path":"/demos/end-to-end/artifacts/reports/positive.json"},{"cors":true,"digest":{"sha256":"683cbf4ec9843a7cee020f4278fb7d0652beebaaf8ad3ef113aa1db3865e8e42"},"mediaType":"application/json","path":"/demos/end-to-end/artifacts/reports/private-schema-violation.json"},{"cors":true,"digest":{"sha256":"1b561b2448fe94afc35cab08c95e8f7fd7f62904a06f0758fc82ff0214faf1dd"},"mediaType":"application/json","path":"/demos/end-to-end/artifacts/reports/removed-predecessor.json"},{"cors":true,"digest":{"sha256":"6d3a3e782f6ef26d3f08698dc2cfc341c2f097fafa417c7d67ed6cee5353ff47"},"mediaType":"application/json","path":"/demos/end-to-end/artifacts/reports/rewired-step.json"},{"cors":true,"digest":{"sha256":"5085ce36d7fbff75b985dff6ec89999f4aee1a6c806d14e1e9fda719af53a6fe"},"mediaType":"application/json","path":"/demos/end-to-end/artifacts/reports/statement-digest-mismatch.json"},{"cors":true,"digest":{"sha256":"d67db9262c3544bb8e08a1652be29214e0e50e6da50918de2ccf211116f10ec4"},"mediaType":"application/json","path":"/demos/end-to-end/artifacts/reports/unauthorized-signer.json"},{"cors":true,"digest":{"sha256":"492a72ee6237d5405155a71c1dc8c6a78eaccd03e90fd5a78683fb99c36fc530"},"mediaType":"text/markdown","path":"/docs/v0.2-adversarial-review.md"},{"cors":true,"digest":{"sha256":"84deb315e42c520091ff511ae165ea43af8d42225e507c97a6345f5c741e57f5"},"mediaType":"text/markdown","path":"/docs/v0.2-architecture.md"},{"cors":true,"digest":{"sha256":"af3562e92f15e6a0c8f3ea4df075ae8f2f42239775d6160095a69b12a460b45a"},"mediaType":"text/markdown","path":"/docs/v0.2-integrations.md"},{"cors":true,"digest":{"sha256":"a218dba378f0af09e10f2b22a899b9f7859753c0d75c2910e2da4d349ebccb9d"},"mediaType":"text/markdown","path":"/docs/v0.2-migration.md"},{"cors":true,"digest":{"sha256":"76a31d3305cf5830d7c59292cb89df17ec8e5174d2d8ce16a9285685411b3294"},"mediaType":"text/markdown","path":"/docs/v0.3-migration.md"},{"cors":true,"digest":{"sha256":"4b10b1e2500edaa095c7771d74f95271acc31b8313a3954cbdbe6a4e4b055a80"},"mediaType":"application/json","path":"/profile/v0.3/license-claim-v1.schema.json"},{"cors":true,"digest":{"sha256":"874de20c3b1c23522f84c48bb847ca7fd6268128715081afc505a44e4d8ef3f5"},"mediaType":"application/json","path":"/release/v0.2/checksums.json"},{"cors":true,"digest":{"sha256":"76ebf79548729eb82687b2b114a8f6a0d9fb774877325e2c3694021979e1711f"},"mediaType":"application/json","path":"/release/v0.3/checksums.json"},{"cors":true,"digest":{"sha256":"bbe34895a60edb2c474ce09ad00169ba88219cad5b14a2422d65f3e1336bb15b"},"mediaType":"application/json","path":"/spec/v0.2/diagnostic-map.json"},{"cors":true,"digest":{"sha256":"119b8b8b03a9764d02b18f7e38441a822052178c76b03b83498cf71aebf8fce1"},"mediaType":"text/markdown","path":"/spec/v0.2/spec.md"},{"cors":true,"digest":{"sha256":"b7a303d51819243f9b2a9abaa77e25c57297139a934a11b1959e3deb83a24bc8"},"mediaType":"application/json","path":"/spec/v0.3/diagnostic-map.json"},{"cors":true,"digest":{"sha256":"c22d3e29e4a3c1ca079702c75be8decf0386496edfc810ecf39e5b320100363e"},"mediaType":"text/markdown","path":"/spec/v0.3/spec.md"},{"cors":true,"digest":{"sha256":"711aeacd1f1d2f8dbf514a48b3d5052c8493afae8177439feafad593262031c9"},"mediaType":"application/json","path":"/tooling/r